{
  "schema": "scfs-github-release-intelligence/1.0",
  "version": "7.8.0",
  "product_id": "product-support-feedback",
  "repository_url": "https://github.com/Content-Catalyst-LLC/sustainable-catalyst-product-support-feedback",
  "configured_repository_url": "https://github.com/Content-Catalyst-LLC/sustainable-catalyst-product-support-feedback",
  "previous_repository_url": "",
  "repository_identity_changed": false,
  "repository_full_name": "Content-Catalyst-LLC/sustainable-catalyst-product-support-feedback",
  "repository_visibility": "private",
  "repository_private": true,
  "repository_archived": false,
  "repository_disabled": false,
  "default_branch": "main",
  "release_state": "stable_release",
  "release_name": "v7.8.0 — GitHub Release Intelligence",
  "release_tag": "v7.8.0",
  "release_url": "https://github.com/Content-Catalyst-LLC/sustainable-catalyst-product-support-feedback/releases/tag/v7.8.0",
  "release_author": "tariqahmad",
  "release_published_at": "2026-07-23T21:00:00Z",
  "release_prerelease": false,
  "release_draft": false,
  "release_asset_count": 2,
  "release_assets": [
    {
      "name": "sustainable-catalyst-feature-suggestions-v7.8.0-wordpress.zip",
      "label": "WordPress plugin",
      "content_type": "application/zip",
      "size": 1024000,
      "download_count": 0,
      "updated_at": "2026-07-23T21:00:00Z",
      "download_url": "https://github.com/Content-Catalyst-LLC/sustainable-catalyst-product-support-feedback/releases/download/v7.8.0/sustainable-catalyst-feature-suggestions-v7.8.0-wordpress.zip"
    },
    {
      "name": "SHA256SUMS",
      "label": "Checksums",
      "content_type": "text/plain",
      "size": 1024,
      "download_count": 0,
      "updated_at": "2026-07-23T21:00:00Z",
      "download_url": "https://github.com/Content-Catalyst-LLC/sustainable-catalyst-product-support-feedback/releases/download/v7.8.0/SHA256SUMS"
    }
  ],
  "semantic_tag_name": "",
  "semantic_tag_version": "",
  "commit_sha": "1234567890abcdef1234567890abcdef12345678",
  "commit_author": "Tariq Ahmad",
  "commit_date": "2026-07-23T20:55:00Z",
  "commit_message": "Release v7.8.0",
  "rate_limit_remaining": "4990",
  "rate_limit_limit": "5000",
  "rate_limit_reset": "1784844000",
  "oauth_scopes": "repo",
  "accepted_oauth_scopes": "repo",
  "organization_approval_hint": "",
  "sync_state": "current",
  "sync_reason": "webhook_release",
  "last_synced_at": "2026-07-23T21:01:00Z"
}
